{
  "$schema": "https://json-schema.org/draft/2020-12/schema",
  "$id": "https://set-apps.github.io/dark-forge/schemas/prompt-catalog.schema.json",
  "title": "Prompt Catalog",
  "description": "Machine-readable catalog of all prompt files in the repository. Auto-generated by bin/generate-prompt-catalog.py and validated in CI. Provides a searchable index with content hashes for drift detection.",
  "type": "object",
  "required": [
    "version",
    "generated_at",
    "prompt_count",
    "prompts"
  ],
  "properties": {
    "version": {
      "type": "string",
      "description": "Schema version for the prompt catalog format.",
      "pattern": "^\\d+\\.\\d+\\.\\d+$"
    },
    "generated_at": {
      "type": "string",
      "format": "date-time",
      "description": "ISO 8601 timestamp of catalog generation."
    },
    "prompt_count": {
      "type": "integer",
      "description": "Total number of prompts in the catalog.",
      "minimum": 0
    },
    "prompts": {
      "type": "array",
      "description": "Array of prompt entries discovered during catalog generation.",
      "items": {
        "type": "object",
        "required": [
          "id",
          "name",
          "description",
          "status",
          "tags",
          "model",
          "file_path",
          "content_hash",
          "last_modified"
        ],
        "properties": {
          "id": {
            "type": "string",
            "description": "Unique identifier derived from the file path (e.g., 'global/summarize').",
            "pattern": "^[a-z0-9][a-z0-9/_-]*$"
          },
          "name": {
            "type": "string",
            "description": "Human-readable prompt name from frontmatter or derived from filename."
          },
          "description": {
            "type": "string",
            "description": "Brief description of the prompt's purpose from frontmatter."
          },
          "status": {
            "type": "string",
            "description": "Maturity status of the prompt.",
            "enum": ["concept", "beta", "production"]
          },
          "tags": {
            "type": "array",
            "description": "Categorical tags for filtering and search.",
            "items": {
              "type": "string"
            }
          },
          "model": {
            "type": ["string", "null"],
            "description": "Recommended or required model for this prompt. Null if model-agnostic."
          },
          "file_path": {
            "type": "string",
            "description": "Relative path to the prompt file from the repository root."
          },
          "content_hash": {
            "type": "string",
            "description": "SHA-256 hex digest of the full file contents for drift detection.",
            "pattern": "^[0-9a-f]{64}$"
          },
          "last_modified": {
            "type": "string",
            "format": "date-time",
            "description": "ISO 8601 timestamp of the last modification (from git log or filesystem)."
          }
        },
        "additionalProperties": false
      }
    }
  },
  "additionalProperties": false
}
