{
  "version": "1.0.0",
  "generated_at": "2026-03-02T22:48:51Z",
  "prompt_count": 75,
  "prompts": [
    {
      "id": "agent-protocol",
      "name": "Agent Protocol",
      "description": "",
      "status": "concept",
      "tags": [],
      "model": null,
      "file_path": "governance/prompts/agent-protocol.md",
      "content_hash": "ab93c9b0fe46e2b74d31c76efdea972726e7418a9041b633789dd5bc497618c2",
      "last_modified": "2026-02-27T17:14:02Z"
    },
    {
      "id": "backward-compatibility-workflow",
      "name": "Backward Compatibility Workflow",
      "description": "",
      "status": "concept",
      "tags": [],
      "model": null,
      "file_path": "governance/prompts/backward-compatibility-workflow.md",
      "content_hash": "ba95fe61201bb49e45298527891ccb359a67729315f584708f3077c981af4d90",
      "last_modified": "2026-02-26T04:34:25Z"
    },
    {
      "id": "checkpoint-resumption-workflow",
      "name": "Checkpoint Resumption Workflow",
      "description": "",
      "status": "concept",
      "tags": [],
      "model": null,
      "file_path": "governance/prompts/checkpoint-resumption-workflow.md",
      "content_hash": "4fbc4c7fedb5cc20dce70b9cfc209292b3d608eedeb190a2336fe908a462c2f3",
      "last_modified": "2026-02-26T04:34:25Z"
    },
    {
      "id": "code-review",
      "name": "Code Review",
      "description": "",
      "status": "concept",
      "tags": [],
      "model": null,
      "file_path": "governance/prompts/code-review.md",
      "content_hash": "e4f941f01a0cdace3bc98b270f01f5a1b9671fb893673c10952293a7444e814d",
      "last_modified": "2026-02-21T21:49:44Z"
    },
    {
      "id": "commit",
      "name": "Commit",
      "description": "",
      "status": "concept",
      "tags": [],
      "model": null,
      "file_path": "governance/prompts/commit.md",
      "content_hash": "5c608e0ba56ad0ea36f54e3c0ac76d9504ca895fb4caacbc31c85c9b73328297",
      "last_modified": "2026-02-21T21:49:44Z"
    },
    {
      "id": "cross-repo-escalation-workflow",
      "name": "Cross Repo Escalation Workflow",
      "description": "",
      "status": "concept",
      "tags": [],
      "model": null,
      "file_path": "governance/prompts/cross-repo-escalation-workflow.md",
      "content_hash": "ec594933c670ba27f7daf481be4ae25a693e8b5c8ee301c0e666820b5ec9667d",
      "last_modified": "2026-02-27T16:44:59Z"
    },
    {
      "id": "data-governance-workflow",
      "name": "Data Governance Workflow",
      "description": "",
      "status": "concept",
      "tags": [],
      "model": null,
      "file_path": "governance/prompts/data-governance-workflow.md",
      "content_hash": "dad7adc7ecd4973003f6e0c988539e055aae59785d56ea34d43f1706f1365add",
      "last_modified": "2026-02-25T18:11:27Z"
    },
    {
      "id": "debug",
      "name": "Debug",
      "description": "",
      "status": "concept",
      "tags": [],
      "model": null,
      "file_path": "governance/prompts/debug.md",
      "content_hash": "e8f1ffb9891cc5e7ec3726b36f80b4777a0a2c21e668fff663bac3e9d9d8df93",
      "last_modified": "2026-02-21T21:49:44Z"
    },
    {
      "id": "devops-operations-loop",
      "name": "Devops Operations Loop",
      "description": "",
      "status": "concept",
      "tags": [],
      "model": null,
      "file_path": "governance/prompts/devops-operations-loop.md",
      "content_hash": "761189d10c312c7cd181c545af98df25b0d59215712b407ba26317df6d883767",
      "last_modified": "2026-03-02T22:30:48Z"
    },
    {
      "id": "di-generation-workflow",
      "name": "Di Generation Workflow",
      "description": "",
      "status": "concept",
      "tags": [],
      "model": null,
      "file_path": "governance/prompts/di-generation-workflow.md",
      "content_hash": "9b648c51667fea2caf8c2b9e961919b4b328da527c429d7749ad99fdacf95597",
      "last_modified": "2026-02-25T23:31:02Z"
    },
    {
      "id": "docx-generation",
      "name": "Docx Generation",
      "description": "",
      "status": "concept",
      "tags": [],
      "model": null,
      "file_path": "governance/prompts/docx-generation.md",
      "content_hash": "50f1f554193dd892c5ccaf7977d58cced88ebf597304dacb7689f328a58b5804",
      "last_modified": "2026-02-21T21:49:44Z"
    },
    {
      "id": "explain",
      "name": "Explain",
      "description": "",
      "status": "concept",
      "tags": [],
      "model": null,
      "file_path": "governance/prompts/explain.md",
      "content_hash": "27bec0812cb0625f3259ad48ad6e938307d558a2d039cada1833ef16d180d914",
      "last_modified": "2026-02-21T21:49:44Z"
    },
    {
      "id": "github-pages-setup",
      "name": "global-ops-github-pages-setup",
      "description": "Sets up GitHub Pages on a repository using GitHub Actions deployment with Jekyll 4.x. Includes workflow creation, Jekyll configuration, Liquid template protection, and optional URL migration.",
      "status": "beta",
      "tags": [
        "github-pages",
        "deployment",
        "documentation",
        "workflow",
        "jekyll"
      ],
      "model": "Claude Sonnet 4.5 (copilot)",
      "file_path": "governance/prompts/github-pages-setup.md",
      "content_hash": "e2d53c07b9b8f4a40d69bca14e4da0563cd808da953adf51461391d6d31c801c",
      "last_modified": "2026-02-21T21:49:44Z"
    },
    {
      "id": "governance-change-proposal",
      "name": "Governance Change Proposal",
      "description": "",
      "status": "concept",
      "tags": [],
      "model": null,
      "file_path": "governance/prompts/governance-change-proposal.md",
      "content_hash": "9bf461cdec50cc2743d40ac86b156727dd0be061d6b25810906cc0e9b1650080",
      "last_modified": "2026-03-02T20:07:01Z"
    },
    {
      "id": "governance-compliance-checklist",
      "name": "Governance Compliance Checklist",
      "description": "",
      "status": "concept",
      "tags": [],
      "model": null,
      "file_path": "governance/prompts/governance-compliance-checklist.md",
      "content_hash": "7872929950bad39f19b03e14d3421062d8880dbf672f0fd6938ce7434894e392",
      "last_modified": "2026-02-26T04:34:25Z"
    },
    {
      "id": "init",
      "name": "Init",
      "description": "",
      "status": "concept",
      "tags": [],
      "model": null,
      "file_path": "governance/prompts/init.md",
      "content_hash": "a7868c0c2049ad87f29002b00cfe334c5159f971303803032453c946567768d0",
      "last_modified": "2026-03-02T19:54:59Z"
    },
    {
      "id": "migrate",
      "name": "Migrate",
      "description": "",
      "status": "concept",
      "tags": [],
      "model": null,
      "file_path": "governance/prompts/migrate.md",
      "content_hash": "8be977978f3d0c9a3d8a85aa9711cb2ab7d771f042e72e6d67a967adc4e54744",
      "last_modified": "2026-02-21T21:49:44Z"
    },
    {
      "id": "plan",
      "name": "Plan",
      "description": "",
      "status": "concept",
      "tags": [],
      "model": null,
      "file_path": "governance/prompts/plan.md",
      "content_hash": "768f7fb6f65fabd72c087c50712a45edb2fa978b5c96b0102c6b76cd475dbe76",
      "last_modified": "2026-02-21T21:49:44Z"
    },
    {
      "id": "refactor",
      "name": "Refactor",
      "description": "",
      "status": "concept",
      "tags": [],
      "model": null,
      "file_path": "governance/prompts/refactor.md",
      "content_hash": "c59596bea7cc9661fbcb7e345c61f00b3db80d9bc1cf61576820e8152e002598",
      "last_modified": "2026-02-21T21:49:44Z"
    },
    {
      "id": "remediation-workflow",
      "name": "Remediation Workflow",
      "description": "",
      "status": "concept",
      "tags": [],
      "model": null,
      "file_path": "governance/prompts/remediation-workflow.md",
      "content_hash": "3c73f18162c6779c87858212d5e8f3160accd30922a44af9c811cb8be13aeb9c",
      "last_modified": "2026-02-25T16:09:46Z"
    },
    {
      "id": "retrospective",
      "name": "Retrospective",
      "description": "",
      "status": "concept",
      "tags": [],
      "model": null,
      "file_path": "governance/prompts/retrospective.md",
      "content_hash": "e4dd3764cac83342019dd6889b0d01c6b27b141a3ee45dc3000eb54a577cc432",
      "last_modified": "2026-02-25T18:11:27Z"
    },
    {
      "id": "reviews/ai-expert-review",
      "name": "Ai Expert Review",
      "description": "",
      "status": "concept",
      "tags": [],
      "model": null,
      "file_path": "governance/prompts/reviews/ai-expert-review.md",
      "content_hash": "c2de94e1c83d9c147f2cdbd5ee30718d78bea109475d61ddc0170765ec29a00f",
      "last_modified": "2026-03-02T20:04:23Z"
    },
    {
      "id": "reviews/api-design-review",
      "name": "Api Design Review",
      "description": "",
      "status": "concept",
      "tags": [],
      "model": null,
      "file_path": "governance/prompts/reviews/api-design-review.md",
      "content_hash": "14ef933c21b99f34f68a9630a95f500cde043a854f9e00adf1de31b555b51982",
      "last_modified": "2026-03-02T20:06:47Z"
    },
    {
      "id": "reviews/architecture-review",
      "name": "Architecture Review",
      "description": "",
      "status": "concept",
      "tags": [],
      "model": null,
      "file_path": "governance/prompts/reviews/architecture-review.md",
      "content_hash": "89476edfc4b78e5020fa86ba0d7b805da65a3d214e50fd56fe229b28300b736d",
      "last_modified": "2026-03-02T20:06:47Z"
    },
    {
      "id": "reviews/code-review",
      "name": "Code Review",
      "description": "",
      "status": "concept",
      "tags": [],
      "model": null,
      "file_path": "governance/prompts/reviews/code-review.md",
      "content_hash": "5edbcefba012ad41248043699723433a9bb153e0c310f22308a4768dfde63d47",
      "last_modified": "2026-03-02T20:06:47Z"
    },
    {
      "id": "reviews/copilot-review",
      "name": "Copilot Review",
      "description": "",
      "status": "concept",
      "tags": [],
      "model": null,
      "file_path": "governance/prompts/reviews/copilot-review.md",